[
  {
    "id": "ping-check",
    "category": "networking",
    "command": "ping -c 4 -W 2 8.8.8.8",
    "title": "Check host reachability",
    "difficulty": "beginner",
    "description": "Send 4 ICMP echo packets to a host with a 2-second timeout to test connectivity and measure round-trip latency.",
    "breakdown": [
      {
        "part": "ping",
        "meaning": "Send ICMP ECHO_REQUEST packets to a network host"
      },
      {
        "part": "-c 4",
        "meaning": "Stop after sending 4 packets"
      },
      {
        "part": "-W 2",
        "meaning": "Timeout in seconds for each reply"
      },
      {
        "part": "8.8.8.8",
        "meaning": "Target host — Google's public DNS server"
      }
    ],
    "flags": [
      {
        "flag": "-c",
        "description": "Stop after sending N packets",
        "source": "local"
      },
      {
        "flag": "-W",
        "description": "Time to wait for a response in seconds",
        "source": "local"
      },
      {
        "flag": "-i",
        "description": "Interval in seconds between packets (default 1)",
        "source": "local"
      },
      {
        "flag": "-s",
        "description": "Specify the number of data bytes to send",
        "source": "local"
      },
      {
        "flag": "-t",
        "description": "Set IP TTL (time to live) value",
        "source": "local"
      }
    ],
    "example": "ping -c 4 google.com",
    "output": "PING google.com (142.250.80.46) 56(84) bytes of data.\n64 bytes from lga34s32-in-f14.1e100.net (142.250.80.46): icmp_seq=1 ttl=118 time=12.3 ms\n64 bytes from lga34s32-in-f14.1e100.net (142.250.80.46): icmp_seq=2 ttl=118 time=11.8 ms\n64 bytes from lga34s32-in-f14.1e100.net (142.250.80.46): icmp_seq=3 ttl=118 time=12.1 ms\n64 bytes from lga34s32-in-f14.1e100.net (142.250.80.46): icmp_seq=4 ttl=118 time=11.9 ms\n\n--- google.com ping statistics ---\n4 packets transmitted, 4 received, 0% packet loss, time 3005ms\nrtt min/avg/max/mdev = 11.8/12.025/12.3/0.192 ms",
    "tip": "0% packet loss with consistent RTT means the path is healthy. High mdev (deviation) suggests an unstable link. Use 'ping -f host' (flood ping) to stress test — requires root.",
    "tags": [
      "icmp",
      "connectivity",
      "latency"
    ],
    "manPage": "8"
  },
  {
    "id": "curl-request",
    "category": "networking",
    "command": "curl -X POST -H 'Content-Type: application/json' -d '{\"key\":\"value\"}' https://api.example.com/data",
    "title": "HTTP POST with JSON",
    "difficulty": "intermediate",
    "description": "Transfer data to or from a server using URLs — supports HTTP, HTTPS, FTP, and dozens of other protocols with extensive flag support.",
    "breakdown": [
      {
        "part": "curl",
        "meaning": "Transfer data from or to a server"
      },
      {
        "part": "-X POST",
        "meaning": "Use POST HTTP method"
      },
      {
        "part": "-H 'Content-Type: application/json'",
        "meaning": "Set request header"
      },
      {
        "part": "-d '{...}'",
        "meaning": "Request body data (JSON payload)"
      },
      {
        "part": "https://api.example.com/data",
        "meaning": "Target URL"
      }
    ],
    "flags": [
      {
        "flag": "-X, --request",
        "description": "Specify request method (GET, POST, PUT, DELETE)",
        "source": "local"
      },
      {
        "flag": "-H, --header",
        "description": "Add a custom header to the request",
        "source": "local"
      },
      {
        "flag": "-d, --data",
        "description": "Send data in a POST request",
        "source": "local"
      },
      {
        "flag": "-o, --output",
        "description": "Write output to file instead of stdout",
        "source": "local"
      },
      {
        "flag": "-s, --silent",
        "description": "Silent mode — don't show progress meter",
        "source": "local"
      },
      {
        "flag": "-v, --verbose",
        "description": "Make the operation more talkative",
        "source": "local"
      }
    ],
    "example": "curl -s -X GET https://httpbin.org/ip | jq .",
    "output": "{\n  \"origin\": \"203.0.113.42\"\n}",
    "tip": "Pipe to 'jq .' for pretty JSON. Use -w '%{http_code}' to see only the status code.",
    "tags": [
      "http",
      "api",
      "requests"
    ],
    "manPage": "1"
  },
  {
    "id": "wget-download",
    "category": "networking",
    "command": "wget -c -P /tmp https://example.com/file.tar.gz",
    "title": "Download file (resumable)",
    "difficulty": "beginner",
    "description": "Download a file to a specific directory with resume support — if the download is interrupted, it continues from where it left off.",
    "breakdown": [
      {
        "part": "wget",
        "meaning": "Non-interactive network downloader"
      },
      {
        "part": "-c",
        "meaning": "Continue/resume a partially downloaded file"
      },
      {
        "part": "-P /tmp",
        "meaning": "Save files to the /tmp directory"
      },
      {
        "part": "https://example.com/file.tar.gz",
        "meaning": "URL of the file to download"
      }
    ],
    "flags": [
      {
        "flag": "-c",
        "description": "Resume a partially downloaded file",
        "source": "local"
      },
      {
        "flag": "-P",
        "description": "Set directory prefix for saved files",
        "source": "local"
      },
      {
        "flag": "-q",
        "description": "Quiet mode — no output",
        "source": "local"
      },
      {
        "flag": "-r",
        "description": "Recursive download",
        "source": "local"
      },
      {
        "flag": "--limit-rate",
        "description": "Limit download speed (e.g. --limit-rate=1m)",
        "source": "local"
      },
      {
        "flag": "-O",
        "description": "Write output to a specific filename",
        "source": "local"
      }
    ],
    "example": "wget -c -q -O /tmp/ubuntu.iso https://releases.ubuntu.com/latest/ubuntu-desktop-amd64.iso",
    "output": "",
    "tip": "Use '--spider' to check if a URL exists without downloading. Combine with '-b' to download in background and '-a download.log' to log progress.",
    "tags": [
      "download",
      "http",
      "files"
    ],
    "manPage": "1"
  },
  {
    "id": "ip-addr",
    "category": "networking",
    "command": "ip addr show",
    "title": "Show network interfaces",
    "difficulty": "beginner",
    "description": "Display all network interfaces and their IP addresses, including IPv4 and IPv6 assignments, MAC addresses, and interface state.",
    "breakdown": [
      {
        "part": "ip",
        "meaning": "Modern Linux networking tool (iproute2 suite)"
      },
      {
        "part": "addr",
        "meaning": "Address management subcommand"
      },
      {
        "part": "show",
        "meaning": "Display addresses (default action, can be omitted)"
      }
    ],
    "flags": [
      {
        "flag": "show [dev]",
        "description": "Show addresses for a specific interface, e.g. 'ip addr show eth0'",
        "source": "local"
      },
      {
        "flag": "add",
        "description": "Assign an IP: ip addr add 192.168.1.10/24 dev eth0",
        "source": "local"
      },
      {
        "flag": "del",
        "description": "Remove an IP: ip addr del 192.168.1.10/24 dev eth0",
        "source": "local"
      },
      {
        "flag": "-4",
        "description": "Show IPv4 addresses only",
        "source": "local"
      },
      {
        "flag": "-6",
        "description": "Show IPv6 addresses only",
        "source": "local"
      },
      {
        "flag": "-br",
        "description": "Brief output — one interface per line",
        "source": "local"
      }
    ],
    "example": "ip -br addr show",
    "output": "lo               UNKNOWN        127.0.0.1/8 ::1/128\neth0             UP             192.168.1.50/24 fe80::a00:27ff:fe4b:1f3d/64\ndocker0          DOWN           172.17.0.1/16",
    "tip": "Use 'ip -br addr' for a compact summary. 'ip addr show dev eth0' filters to one interface. Replaces the deprecated 'ifconfig' command.",
    "tags": [
      "interfaces",
      "ip",
      "iproute2"
    ],
    "os": [
      "linux"
    ],
    "manPage": "8"
  },
  {
    "id": "ip-route",
    "category": "networking",
    "command": "ip route show",
    "title": "Show routing table",
    "difficulty": "intermediate",
    "description": "Display the kernel routing table — which network destinations are reachable via which gateways and interfaces.",
    "breakdown": [
      {
        "part": "ip",
        "meaning": "Modern Linux networking tool (iproute2 suite)"
      },
      {
        "part": "route",
        "meaning": "Routing table management subcommand"
      },
      {
        "part": "show",
        "meaning": "Display routes (default action)"
      }
    ],
    "flags": [
      {
        "flag": "show",
        "description": "Display all routes",
        "source": "local"
      },
      {
        "flag": "get <IP>",
        "description": "Show which route would be used to reach an IP: ip route get 8.8.8.8",
        "source": "local"
      },
      {
        "flag": "add",
        "description": "Add a route: ip route add 10.0.0.0/8 via 192.168.1.1",
        "source": "local"
      },
      {
        "flag": "del",
        "description": "Delete a route: ip route del 10.0.0.0/8",
        "source": "local"
      },
      {
        "flag": "default",
        "description": "Add default gateway: ip route add default via 192.168.1.1",
        "source": "local"
      }
    ],
    "example": "ip route get 8.8.8.8",
    "output": "default via 192.168.1.1 dev eth0 proto dhcp src 192.168.1.50 metric 100\n192.168.1.0/24 dev eth0 proto kernel scope link src 192.168.1.50 metric 100\n172.17.0.0/16 dev docker0 proto kernel scope link src 172.17.0.1 linkdown",